Rating,Review,Reviewer
7,"Ten years and 18 Marvel movies; 19 now, with the arrival of Avengers: Infinity War. This must surely be the most remarkable movie series in history, at least since the time when film was the TV of its day and moviegoers got endless installments of Sherlock Holmes fighting Nazis and Charlie Chan solving mysteries. Except the Marvel Cinematic Universe has been one big interconnected story: sprawling, yet also economical, with the chapters and multimovie threads standing pretty much on their own while also sending tendrils out to take root in others. And how they finally come together here… *whew.* It’s almost too much to take in, yet somehow not enough at the same time. I’m not ready to see this story end.
Infinity War is to the decade of MCU storytelling what huge-ass battle finales are to the modern comic-book movie. A single movie may end with 20, 30, or 40 minutes of random mass urban carnage caused by CGI heroes and villains punching one another. Ten years of story gets ya two and a half hours of smash-crash-bash ranging across multiple locales on Earth and multiple planets out in the wider galaxy. Now, Infinity War does not fall prey to the problems that have made some of those big battles tiresome, such as forcing the plot to come to a standstill: the series of interrelated and escalating fights is the plot, anyway. And more importantly, complex and compelling characters don’t take a back seat to the action. Directors Anthony and Joe Russo, returning from two of the three Captain America movies, treat the many fight sequences with clarity and originality. We never feel like we’ve seen these huge-ass final battles before. But this may still feel like a slog to anyone who is tired of how this has come to dominate the subgenre, because there’s not much else going on here.

Then, too, there’s an almost a grueling number of characters to keep track of; sometimes it takes forever for the movie to get back to a thread you were particularly intrigued by; other times you’ve completely forgotten someone else was left hanging (sometimes literally) until the movie jumps back to him (or, very more rarely, her). It’s not everyone we’ve ever met in the MCU — there are some notable absences — but it might as well be. Still, screenwriters Christopher Markus and Stephen McFeely, who’ve written or contributed to the scripts for a bunch of MCU flicks, manage to advance the tales of a few of the most beloved of them, mostly Tony Stark/Iron Man (Robert Downey Jr: The Judge, Chef), Thor (Chris Hemsworth: 12 Strong, Ghostbusters), and Steve Rogers/Captain America (Chris Evans: Snowpiercer, What’s Your Number?). Gamora (Zoe Saldana: I Kill Giants, Live by Night) gets a meaty chunk of story, too, though it might feel that way only because she has not been a character explored in much depth before, so there’s lots to learn about her. And also because it is through her and her connection to the villain, Thanos (CGI’d Josh Brolin: Only the Brave, Hail, Caesar!), that we begin to understand how enormous a task the Avengers and friends are facing this time out.
“It’s not overselling it to say that the fate of the universe is at stake,” Doctor Strange (Benedict Cumberbatch: Zoolander 2, Black Mass). It seems than Thanos, your basic run-of-the-mill alien madman, is trying to collect the six Infinity Stones, “elemental crystals” leftover from the birth of the universe, which, when gathered together, will allow him to perform evil on a scale previously unknown in the cosmos. Worse, he thinks the evil he wants to do is a mercy. He must be stopped, natch.

Many exciting interstellar venues and planets are visited in this movie; my favorite might be the badass dying-star-powered forge that Thor drops in on in the hopes of getting a replacement for his lost hammer, Mjolnir. But two of these Infinity Stones are on Earth, so our poor planet is a draw for bad guys once again. Apparently these Infinity Stones have been lying around in plain sight! One was in the Tesseract, which has been all over the MCU, including lately in the possession of Loki (Tom Hiddleston: Early Man, Kong: Skull Island); one is in the forehead of Vision (Paul Bettany: Journey’s End, Legend), helping to power the android AI’s personality; another is in Strange’s keeping, and fuels his magic. Did we know that these objects were even more than what they appeared to be? I can’t remember. Infinity War has given me a little satisfied tickle of “aha! that’s how it all fits together!” but that might be just because, while I’ve seen all these movies, some more than once, I haven’t studied them.
That might be the sweet spot from which Infinity War is best appreciated, the one between being a complete Marvel neophyte and being too overindulging a fan of these movies, too steeped in the minutiae of their lore, and in that of the comics behind them. I cannot imagine how anyone who hasn’t seen most of the 18 previous movies will find any kind of foothold here from which to appreciate anything that’s happening or any of the people it’s happening to. Never mind missing some of the fun nuances that comes with realizing that, holy crap, so many of the characters here are suffering from major daddy issues — Stark, Thor, Gamora, Peter Quill/Star-Lord (Chris Pratt: Passengers, The Magnificent Seven) — while Thanos is serving as a sort of ultimate stern father to a cosmos that, he believes, has been very naughty and thoughtless, like a child. But without all the backstory of mostly traumatizing experiences almost everyone here has been through, the humor that wends through the movie might come across as unseemly, what with the fate of the universe at stake and everything, rather than a bitter coping mechanism for all these damaged heroes. On the other, I’m sure I can’t even imagine all the inconsistencies and incongruities that have popped up across all of these movies, and I’m glad my head was not full of them as I sat with Infinity War. It’s more than enough for me to have noted that Peter Parker/Spider-Man (Tom Holland: Pilgrimage, The Lost City of Z) appears to have jumped back in time from the events of his standalone movie, which seems to have been set a good few years after the events here.

From my middle ground — not too geeky, not too mundane — the superhero orgy of Infinity War was a whole lotta just right. And I include in that how it exhausted me, and ultimately how it stunned me. The MCU has been no stranger to darkness, but the darkness here has a depth and a horror that rattled me like the MCU never has before. Yes, there’s another (last?) Avengers movie coming next year, but there’s a finality to this one that, I suspect, will be difficult to dispel.",MaryAnn Johanson
9,"I try to write things that are spoiler free (for the most part). Here it’s kind of hard to talk about anything without spoiling at least something being that it’s the culmination of 20 or more movies so spoilers follow (probably).

This movie delivers. I’ll get that out of the way as many people weren’t sure during the lead up to this film. But this movie hits hard in every way it can. It gives Thanos enough screen time and backstory to make up for him getting almost none before this movie. It gave all the heroes throughout the movie their own story and screen time as well, though a few were settled into the background, such as Black Widow or Warmachine, but they still get plenty of action scenes so it’s cool. I guess I’m a little disappointed they didn’t further explore Black Widows and the Hulk’s romance but I’m a bit of a shipper when it comes to those two…

I have to admit that I’m very impressed. It’s tough to make a movie like this, I mean, any of the Avengers movies is everything that’s come before all mixed together no matter what’s going on in each individual’s storyline. And IT STILL HAS TO BE A GOOD MOVIE! If it isn’t it could kill the whole MCU! I don’t think anything like this has come before where so many different movies crossover so epically every once in a while. I guess DC keeps trying to do things like this but never quite finding the right tone or audience with their movies.
I think I’ll talk a bit about DC vs Marvel for a second. Truthfully, if anyone remembers, before Iron Man came out, DC was the place to be when it came to each universes’ movies. The original Superman and Batman movies are still classics and great adaptations of their comic book counterparts. Christopher Nolan’s the Dark Knight Trilogy was amazing too when that came out. Before Spiderman and X-Men, there wasn’t ever a good Marvel movie and most of them were direct-to-video if anyone even remembers those terrible movies. Oh, wait, except Blade. I always forget about Blade. Man that movie is awesome!… Anyway, Spiderman and X-men were okay, but at the time I think everyone could agree that Batman was better, and no one really took them seriously anyway. That is, until Iron Man came out and Disney showed everyone that they still knew how to make fun movies, and also proved that superhero movies could be more than just two hours of action tropes. It also made a kagillion dollars and then when Avengers came out it was the highest grossing movie ever. So that’s when DC stopped caring about content so much and tried really hard to make their own franchise IN THE LINE OF MARVEL! But the reason it doesn’t work so much is because it’s trying too hard to do what works for them in the comics, being darker and pushing the envelope, but they also are COPYING MARVEL! It’s obvious when they do it and their movies suffer for it. They need to just do their own thing and stop chasing Marvel’s coattails. They struggle to find an audience because they keep rejecting their true fans for bigger game.",Nathaniel R. Mitchell
9,"Thanos (Josh Brolin) has arrived…and he wants the remaining Infinity Gems.  With Doctor Strange (Benedict Cumberbatch) and Vision (Paul Bettany) housing stones on Earth, Thanos has sent emissaries to the planet to claim the stones while Thor (Chris Hemsworth) finds the stone housed in the Tesseract could bring death to himself, Loki (Tom Hiddleston), Hulk (Mark Ruffalo), and the Asgardians.  The Guardians of the Galaxy could hold the key to another stone as the time ticks down to save the universe.  Meanwhile, Tony Stark (Robert Downey Jr.) finds himself and Peter Parker (Tom Holland) headed to space in a desperate rescue attempt and a last ditch effort to stop Thanos.  As alien forces amass with Earth in their sights, Wakanda and the Black Panther (Chadwick Boseman) could be Earth’s best change to save the universe…but Thanos is strong and his power is unparalleled.

Directed by Anthony and Joe Russo, Avengers:  Infinity War is the nineteenth film in the Marvel Cinematic Universe and concludes their “Phase Three” films which began with Captain America:  Civil War (2016).  The movie adapts portions of 1991’s The Infinity Gauntlet and 2013’s Infinity.  The movie follows Black Panther (2018) and was released to massive box office returns and positive reviews.  The film was nominated for an Academy Award for Best Special Effects
Of the MCU, the Avengers films aren’t very high on my list.  The first film was bloated and dull and the second film just wasn’t very good in general.  As a lifelong comic book reader (30+ years), the comic book boom is something I dreamed of as a kid.  In that sense, Avengers:  Infinity War didn’t fail me.  As a safety measure, a ******spoiler alert****** is in effect for the rest of the review.

The movie above all things is a spectacle.  Visually, it is pretty compelling and really nails down the look of a comic book.  This wasn’t the most difficult thing in reality, they have had eighteen movies to warm up to it and not all hit the mark…but Infinity War does.  It is big, brash, and visual.  The characters really work well together and moments like the throwdown with Thanos on Titan with Mantis, Star-Lord, Iron Man, Spider-Man, Drax, and Doctor Strange present visual high points.  Likewise the battle in Wakanda blended space adventures with something like Braveheart in a way that works…I was really over the over-the-top Avengers music soaring in every time that some character showed up though.
The cast also has fallen into the roles.  There are surprisingly few character Easter eggs in a movie that I thought would try to introduce more and more characters (Ross Marquand replaces Hugo Weaving as a fun Red Skull cameo).  With such a big cast, the movie does a strong job balancing it (for the most part).  There is a lot less time for jokes and one lines from characters who can’t deliver one liners (which is a good thing to me), and I wasn’t sure how all the sarcastic characters like Doctor Strange, Iron Man, and Chris Pratt’s Star-Lord would play together, but they are actually a team…and the meeting of egos works.  The surprising and strongest performances come from Josh Brolin as Thanos himself (though he was originally mocked in early trailers) and his play off of his adopted daughter Gamora played by Zoe Saldana in some of the movie’s only slow moments.
What will work for some and not work for others is that it is a comic book movie at its core.  The action jumps all over the place in a fashion like the Lord of the Rings films and it is a lot of fighting.  It isn’t necessarily a cohesive story as a standalone, and if you haven’t seen a majority of the films, it might make little sense.  This all culminates in an ending that is more set-up for future movies (and could ruin some of the franchises that others like depending what is done in the follow-up Phase 4 movies).  If you loved the Black Panther, you might be a bit disappointed in Avengers:  Infinity War since it takes so long for the characters to show up and Wakanda doesn’t stand much of a chance against Thanos’ forces.  Characters like Hawkeye and Ant-Man were oddly absent (and written off weakly) while the Asgardians were unceremoniously slaughtered off camera after the fun Thor:  Ragnarok…running the risk of being an Alien3 situation (but not quite that bad).  It is this weird balance in the storytelling that could be off-putting to some.

Avenger:  Infinity War is a lot of things.  If nothing else it is a spectacle and amazing as a long time comic book reader.  I know how the story pans out (in comics) and I am already imagining how the MCU will write its way out of the problems of the actors’ contracts running up for the Avengers sequel (scheduled for 2019)…reality can literally be warped so I guess I shouldn’t worry about sequels to the films I like.  Avengers:  Infinity War is followed by Ant-Man and the Wasp in 2018 as well.
",JP Roscoe
7,"Listing the cast members may take longer than writing the review for Avengers: Infinity War, but even with all of these characters to remember, the movie does a splendid job of keeping the plotlines and the characters straight.    There are even helpful titles to tell us where various characters are.   The Lord of the Rings series could have used this and cut down on the confusion.

But, Avengers: Infinity War isn't simply a triumph of keeping things organized, but it also gives us a villain with depth and dimensions.  This adds an extra level of intrigue to his scenes.   Thanos (Brolin) is indeed a very powerful villain, but he also feels love, regret, respect, and sympathy.   Not that these distract him from his goal of wiping out half of the population in the universe, but he even does that more of out of necessity and practicality in his eyes than sheer evil intentions.    We pretty much know what to expect from the Avengers themselves, but there are a few surprises with them also.

The Avengers and The Guardians of the Galaxy are trying to stop Thanos from possessing six infinity stones which would help him reach his goal.    He believes wiping out half of the universe will allow for more evenly distributed wealth and resources.     Ebenezer Scrooge wanted to see the surplus population decreased.    Thanos would tell Scrooge to hold his beer while he took it a step further.   I wouldn't dream of revealing what happens, but this entry in the Marvel Universe deserves credit for allowing its story to go to the dark place it needs to go.

Of course, there is CGI galore and action bulging from all parts of the screen, but Avengers: Infinity War still finds space to tell a story and present us with the most complex villain of the series so far.   Thanos looks like a purple hulk with strength to spare, but his conflicted feelings towards characters like Gamora (Saldana) and Nebula (Gillan) allow his scenes to resonate with us more than just a giant baddie who will inevitably get his ass whipped.    Or will he?   This is the first Avengers film in which the outcome is not etched in stone and its people are allowed to grow at least a little. ",Doug Fisher
