Rating,Review,Reviewer
9,"Marvel Studios has accomplished something seemingly impossible. They have created an entire universe full of franchises that ebb and flow with excitement for not only the team-up films, but the solo efforts as well. The idea started ten years ago with Iron Man (2008), a blockbuster that is about as standalone as it gets until its post-credits scene. There, we meet Samuel L. Jackson’s Nick Fury and he tells Tony Stark (who is but a surrogate for the audience) that there is an “Avengers Initiative.” The seed was planted, but it didn’t fully bloom until four years later when Marvel unleashed The Avengers (2012). Not only did that film pay off elements established in the five films that came before it, but it also laid the groundwork for everything that came after. The Avengers raised the profile for every Marvel character and resulted in each of the solo sequels earning more at the box office. Marvel Studios created a cycle (which they call phases) where audiences could follow their favorite characters in their own movies, then introduce new characters, and see them team up in bigger films. They perfected what comic book readers love about comics, and now it seems movie audiences love this type of storytelling too.
More so than say Avengers: Age of Ultron (2015) or Captain America: Civil War (2016), Avengers: Infinity War feels like the true culmination of the eighteen films that came before it. Nearly every protagonist seen in the previous Marvel Cinematic Universe (MCU) films makes an appearance in this gargantuan film. In what could have been a daunting task for any director (or in this case, directors), Anthony and Joe Russo once again nail the spirit of an MCU movie while balancing an enormous cast of wide-ranging characters.

Thanos says it best, “Perfectly balanced, as all things should be,” and while he’s talking about the vision he has for the fate of the universe, he could be referring to the approach the Russo Brothers took with this movie. The directing duo, also responsible for Captain America: The Winter Solider (2014) and the aforementioned Captain America: Civil War, balance a universe-sprawling epic plot with plenty of heart, humor, and big budget thrills that is sure to leave any viewer floored. They aren’t afraid to take risks either as Infinity War is truly one of the most shocking MCU films to date and will likely leave more than a few viewers gutted by the time the credits roll.


 This film, more than any other in recent memory, must be experienced more so than read about. A plot summary or synopsis will not do the grand scope the Russo brothers were trying to accomplish justice, but the set-up is simple: Thanos (Josh Brolin) wants to gather all six Infinity Stones (five of which have been seen in other MCU movies such as The Avengers, Thor: The Dark World [2013], Guardians of the Galaxy [2014], Avengers: Age of Ultron, and Doctor Strange [2016]) so he can wipe out half the galaxy with the snap of his fingers. Heroes like Iron Man (Robert Downey Jr.), Captain America (Chris Evans), Thor (Chris Hemsworth), Doctor Strange (Benedict Cumberbatch), Black Panther (Chadwick Boseman), and the various Guardians of the Galaxy don’t like the sound of that, so they try to stop the Mad Titan from gathering all the stones. There’s a lot of characters doing a lot of things, so those who have kept up with the MCU thus far will have a leg up on those who haven’t been doing so. The filmmakers assume you have seen most of the other movies so they spend little to no time defining the characters, which is fine since that’s what the other movies were for. This truly is the ultimate payoff of a decade worth of films and it rewards fans ten-fold. In fact, the bigger the fan you are of the MCU, the more you are going to get out of this movie, which is another way of saying that this might not be a great jumping off point for those who have never seen a MCU movie.

The story is sprawling and epic in every way imaginable, but it’s also remarkable how each character still feels the same from their previous installments. For example, heading into the film I was slightly nervous about how the Guardians of the Galaxy were going to come off since they weren’t being written by James Gunn, who had done the two Guardians films. That worry was unfounded as the Guardians as they were in their own movies, and kind of steal the show. That holds true for the rest of the characters as Marvel has truly mastered how to transition their characters from solo movies to the team-up films almost seamlessly. It’s not only a treat for any fan to watch, but it’s also immensely rewarding. Character arcs from other films pay off in big ways—especially when it comes to Thor. This is impressive when they are essentially introducing the character of Thanos. Yes, we have seen Thanos in other films before this, but this is the first time we get to know the character, and he’s arguably the lead of the film. It goes back to how well-balanced the film is that the Russo brothers can afford every character their own moment to shine while also giving Thanos the proper introduction and arc he deserves. Brolin absolutely kills it as Thanos as he nails the overwhelming power of the character while also playing the character with subtly and nuances that aren’t usually seen in a comic-book villain. He isn’t mustache twirling or overly dramatic, he just believes that this is what needs to be done and he’s the only one who can do it.
Lots of people go to these movies for the big budget spectacle, and the Russo brothers make sure that those people will not be disappointed. The film has numerous action set pieces, all with varying levels of scale, which keep them from all feeling the same. There’s some action moments with two or three characters, and then there’s the epic war-sized action scenes, both of which are handled expertly by the directors. The two showed that they could do more grounded fight scenes in Winter Solider, then proved they could handle group battles in Civil War, and then doubled-down to make Infinity War. The action is clever and fast-paced with characters in groups we have never seen before. Every character has a moment to shine, once again bringing it back to the film’s unbelievable balance. Thanos proves to be a unique challenge for the Avengers and the film features many clever ways as to how they attack the mighty villain. There’s fun to be had, but the film does start to struggle with how and when to show all the action. There’s essentially two climaxes happening at the same time and the film cuts between the two without much reasoning, even at times undermining some key moments. It’s all in service of telling the larger-scale story, but it does show that there is at least some validity in the argument of this film being simply too big.

That is an incredibly minor road bump in what is one truly incredible ride the Russo brothers expertly guide MCU fans on. Avengers: Infinity War could have been a hot mess with too many characters and the weight of 18 previous films crushing the overall enjoyment of one movie, but the outcome is the complete opposite. Avengers: Infinity War is fun and thrillingly zips through its 156-minute running time and features an ending that shows the MCU can still deliver the audience high stakes indeed. The bigger fan of the MCU you are, the more enjoyment you will take from Avengers: Infinity War, but even mild fans will enjoy the sheer scope of the film. It’s a gigantic ride that will leave you breathless and anxious for Avengers 4.",Scott Davis
8,"Ten years, nineteen films and the most audacious experiment in franchise filmmaking ever: the conclusion to Marvel’s grand project has finally arrived. The biggest entry in the studio’s series to date, Avengers: Infinity War is at once exhausting, exhilarating and triumphant.

Thanos is coming. Ever since the Mad Titan (Josh Brolin) was teased at the end of Avengers Assemble, the threat of his arrival has lurked in the shadows of every entry to the Marvel Cinematic Universe. But with the most frequent complaints levelled against the mega series being the lack of long-lasting consequences and underwritten baddies, it wasn’t enough that Thanos merely showed up to the party: he had to play for keeps. And boy, does he, both in terms of Brolin’s operatic performance, his truly cosmic quest, and writing with enough depth to make his genocidal vision almost understandable. X-Men take note – this is how you write the Apocalypse.

Beginning in media res, Thanos has decimated the Asgardian refugees last seen at the end of Thor: Ragnarok and has already acquired the power stone – one of six gems with the power to end the universe – from the planet Xandar. The film’s first act has a lot of narrative ground to cover, but its sheer sense of urgency balances out any expositional overload. Nevertheless, Infinity War asks a lot of its audience and expects as a bare minimum a working knowledge of the series timeline to date. Moreover, that aforementioned urgency means any breathing room for meaningful characterisation is dispensed with, the expectation being that we all know by now the main players.

Infinity War’s unwieldiness does beg the question of whether it works as a film in its own right. It’s an exhausting barrel roll of a narrative, functioning less as a complete story and more as a frenetic series finale, the last act of a lengthy space opera. Directors Anthony and Joe Russo spin a universe-spanning array of plates to include almost every major character in Marvel’s playhouse, each with brief but well-drawn motivations – an impressive feat in itself. The effect can be dizzying, but there’s no denying the consummate skill in cross cutting between three disparate sets of heroes, multiple set pieces in parallel and the star villain in the centre. Indeed, rather than a sequential narrative, Infinity War more resembles an enormous comic splash panel on the screen.

The rousing Avengers theme – the most memorable of Marvel’s otherwise underwhelming scores – is used frequently and with brio by veteran composer Alan Silvestri. Visually, it’s no exaggeration to say this is the studio’s most cinematic film to date. Trent Opaloch’s cinematography balances cosmic scope and spectacle with performance-privileging close-ups, while Jeffrey Ford and Matthew Schmidt’s editing miraculously maintains the dramatic impetus crucial to keeping the whole enterprise afloat.

Easily the best of the three Avengers films, Infinity War is not quite up there with the human-centred drama of Black Panther or indeed the Russos’ Captain America entries. And despite the film’s operatic grandeur, it simply can’t hold a candle to the emotional and thematic heft of a Dark Knight or a Logan. Additionally, though there are heavy consequences galore here, one suspects that many of them will be undone in next year’s Avengers follow-up – an unfortunate case of commercial prerogative triumphing over dramatic integrity. Nevertheless, as an unfathomably huge, wildly entertaining blockbuster and the culmination of a grandiose experiment, Avengers: Infinity War is a titanic achievement.",Christopher Machell 
10,"Too often in comic book stories, the villain is motivated by greed or power. They not only are evil, but they know they are evil, and you will submit to them or fork over all your cash, depending on the depth of their megalomania.

The best villains, however, see themselves as the heroes of their own story, and act accordingly. Thus it is with Thanos, in a lifetime achievement role for actor JOSH BROLIN. All Thanos wants to do is eliminate poverty, make sure there are plenty of resources for people to live on, and see the universe at peace. And to do this, the only thing he needs to do is simply cut the existing population in half.

That's a lot of life to have to snuff out. But he can do it, if he acquires all six of the so-called Infinity Stones, gems of amazing power created at the moment of the Big Bang. We've seen these stones in different Marvel Cinematic Universe pictures, although they haven't always been called by those names. Thanos's quest to acquire these stones takes him the length and breadth of the Marvel Universe, and it is a credit to directors Anthony and Joe Russo that at no time in this tour-de-force does the viewer ever get lost.

Everyone who's ever appeared in the MCU is in this film, including some villains you thought you had seen the last of a long time ago. The plot threads of THOR: RAGNAROK, GUARDIANS OF THE GALAXY V2, BLACK PANTHER, and CAPTAIN AMERICA: CIVIL WAR all come together, making clear how these different movies were all parallel chapters that were inexorably leading up to this point.
For it's length, INFINITY WAR is incredibly fast paced, almost impossibly mixing action, drama, and comedy into a tapestry of pure superhero movie genius. The interactions between characters like Spider-man (TOM HOLLAND), Iron Man (TONY STARK), Doctor Strange (BENEDICT CUMBERBATCH) and Star-Lord (CHRIS PRATT) are fantastic. The reticence of Hulk (MARK RUFFALO) underscores just how deadly a foe Thanos is, and the arrival of Thor on the scene of one of the battles had the audience in our press screening clapping and cheering.

There's so much to talk about with INFINITY WAR -- seemingly infinity, appropriately enough. But the only way to really appreciate the scope, depth, and -- ultimately -- jaw-droppingly tragic film is to experience it for yourself. We look forward to a spirited conversation in the threads below!",RJ Carter
9,"What the...? Like many Marvel fans, I was eager to see last night's long-awaited Avengers Infinity War. I had my concerns – like how do you cram that many superheroes into one story line without it seeming, as one review has it, 'over-stuffed'? Will it make narrative sense? Or will it just come across as beauty pageant for squabbling super-egoes?

The answer, to my relief, was that it worked and, mostly, worked well. OK. The strain showed in one or two places. But on the whole it is a thumbs up for an ensemble movie that many feared even experienced directors Joe and Anthony Russo could not prevent from descending to meaningless jumble. It did not.
OK. There was some trade-off between cast size and plot subtlety. Because there was nothing terribly subtle about the plot of Infinity War. The film opens with a MayDay from an interstellar craft that Marvel fans will quickly realise is the one last seen escaping the fall of Asgard in Thor: Ragnarok.

Cut to onboard, where psychotic murderer/benevolent philanthropist Thanos (Josh Brolin) – it depends on your point of view – has just finished wiping the floor with Thor (Chris Hemsworth) and Loki (Tom Hiddleston). Loki, it seems certain, does not survive this encounter. And then we're off, with Thor escaping and Thanos on a galaxy-wide quest to locate the Infinity Stones, which, once assembled in one place on his gauntlet will give him immense unstoppable power.

Any similarity between the plot of this film and a game of Trivial Pursuit begins and ends with the colour of the stones (blue, red, yellow, purple, green, and orange) which almost exactly match the six colours of pie (blue, pink, yellow, purple, green and orange) that you need to collect to win the latter.

The difference? The worst consequence of Trivial Pursuit is that the winner can get a little big-headed and insufferably smug for a while: whereas the aim of Thanos, once he has collected all the pieces of pie – sorry, infinity stones – is that once he has them assembled he will be able to wipe out one half of all life in the universe.

So it is chase and jeopardy. Different sub-sets of the Avengers, including Tony Stark/Iron Man (Robert Downey Jr), Spiderman (Tom Holland), Doc Strange (Benedict Cumberbatch), Peter Quill/Star Lord (Chris Pratt), Natasha Romanoff/Black Widow (Scarlett Johansson), Gamora (Zoe Saldana) and many, many, many more coalesce in locations across the Galaxy, just in time to be beaten to the local infinity stone by Thanos.

There is a great side-arc in which Thor reforges his hammer – a sort of Mjollnir mark two with added rainbow powers. And there is more insight, back story to characters like Gamora. In the end, though, most return to Wakanda, the Kingdom of T'Challa / Black Panther (Chadwick Boseman) for a grand finale confrontation with Thanos and his forces. Which is where the surprise and the spoiler and the thing I have promised on no account to tell you about happens.

Along the way there is the usual banter and clashing of egos.. In advance, I had misgivings as to whether the pace and style of, say, early Avengers could be brought matched to more played-for-comedy films like Guardians Of The Galaxy. My fears were misplaced. For there has been a long-term convergence across the massive story arc to which the Infinity War represents culmination.

The ego-clash between Tony Stark and Doc Strange is to be expected and here handled with a masterful combination of serious and wise-cracking, as well as contemporary reference aplenty. In this case to the Ben and Jerry specials named for their respective characters! Ditto the first encounter between Thor and Star Lord in which Quill, feeling his masculinity affronted by the mere presence of the Asgardian, attempts to lower his voice to match Chris Hemsworth's delivery.

There is also loss and much sadness, too. A constant recurring theme is whether one individual should sacrifice him/herself for the sake of the many. It's a dilemma faced in different ways by two very different couples: Quill/Gamora, and Wanda/Scarlet Witch (Elizabeth Olsen) and Vision (Paul Bettany).

And in such a battle, it is inevitable that many will fall. Infinity War does not end with Avengers triumphant, save one lone casualty: there are many, and who will be resurrected again through future plot twists, we must wait and see. Infinity War is a clearing of the decks: opportunity for new characters and plots to emerge; opportunity too for some characters to move on.

Any failings? Yes: for despite running to over two and a half hours, there were plot threads and themes not explored as much as I would like. Both Thor and Doc Strange were, I felt, under-played, given that they represented the two most powerful pieces on the battlefield after Thanos. In the case of Thor, it was the plot that kept him away from the action. For Doc Strange, it was script weakness that turned all of his dark arts into hand signalling – and one cryptic prohpecy about how Thanos might be defeated.

I am now looking forward to the director's cut which, I would expect to run to well over four hours!

Also, once seen, it cannot be unseen. An analysis of Star Wars by someone who knows a thing or two about military tactics, highlighted the ridiculousness of modern armies, armed with advanced particle weapons, forming up like some ancient world phalanx...then abandoning their positions to charge across a battlefield and engage with the enemy. Like, no commander in their right mind would do that.

But it makes for good cinema. And so these were the tactics on display in Wakanda once more.

Despite all of that, a brilliant Marvel film.
",Jane Fae
9,"Marvel and The Russo Brothers had a very daunting task before them. Paying off the culmination of a decade of build-up and backstory, stretching over 18 films, is a challenge unlike any studio or director in Hollywood had ever faced. And to accomplish this feat, they worked with what has to be the largest cast of known stars ever assembled for a movie. The ambition of Marvel and its commitment to the cinematic universe it pioneered is worthy of praise and respect.

If there’s one thing I was looking for in Avengers: Infinity War, it was raised stakes. Much like the comic books these films are based on (in which characters rarely die and cities are destroyed without much afterthought), Marvel films have not fully dealt with loss in a way that seems realistic. Right from the start of Infinity War, though, Marvel makes it very clear that has changed. The potential consequences of a Thanos (Josh Brolin) victory are evident and the film progresses with an emotional weight and sense of urgency that it could not have attained if the studio followed its same old formula. This also creates much more investment in characters and the worlds they inhabit, and thus pays off quite a few very moving scenes in a much bigger way. If you haven’t cried in a Marvel movie before, you’re not alone, but this may be your first. I had genuine chills a few different times. But don’t worry, that trademark Marvel humor and witty one-liners are still there and won’t have you depressed for too long at a time.

Another area that Marvel outdoes previous films in their own franchise is with Thanos himself. Make no mistake, this is his film and his story. He is a fully developed villain with more screen time than any before him, and it helps to create a character with whom the audience can both despise and yet struggle with feelings of empathy for. Brolin’s talent is very obvious in this performance despite the incredible looking CGI that encompasses him. His Thanos is not just some loud, angry, destructive villain. He is intelligent and calculating. He is nuanced. He is cold, yes, but when he gives his reasons for what he wants to do with the Infinity Stones and why, in a very warped way it makes some sense. His presence as the foil to the Avengers and Guardians gives this film something unique and memorable.

With a cast this large it is inevitable that not everyone’s favorite will have the responsibility or amount of action they hope for. The Russo’s do an admirable job of balancing these heroes, however, and somehow left me feeling satisfied. Sure, a little more backstory or deeper character moments for them all would be nice, but it’s also unrealistic to expect in a single film of this length. By managing to give everyone at least one small moment in the sun, the Russo’s succeed where I believe many would have failed. Another result of keeping most character development small is that the film moves fast, pausing a few times for majorly impactful storyline beats, but mostly cutting between different groups of heroes working to accomplish different tasks. By keeping the heroes in smaller groups, we get to feel more focused when we’re with them, and enjoy the new forms of dialogue that emerge between characters who previously had not interacted.

The action in Avengers: Infinity War is, as expected, fantastic. Seeing heroes fight together with new gear and weapons, or teaming up in ways never experienced by movie goers before, was a huge treat. In one major battle that involves a host of heroes and countless alien attackers, the Silvestri score and rising stakes create a feeling similar to that in the Battle of the Pelennor Field from The Return of the King. While Avengers: Infinity War never quite reaches that level of epic, it comes much closer than many (myself included) ever thought possible.
If you’re thinking that this review is a but vague, please know that is by design. Fans have waited 10 years for this and going in with as little information possible is going to result in the best viewing experience. Avengers: Infinity War isn’t entirely unpredictable, but it’s got some surprises too. The historic puzzle that the Russo Brothers have put together is nothing short of amazing and will lend itself to multiple viewings. Perhaps that’s the highest praise possible for a film of this kind, that after it finished I immediately would have sat through those 2.5+ hours again. To sum it all up, Avengers: Infinity War lived up to the hype by being both entertaining and emotional. Well done, Marvel. Well done.",Aaron White
